{
  "type": "LOINC",
  "code": "70299-3",
  "name": "Anemia management panel",
  "items": [
    {
      "questionCode": "718-7",
      "localQuestionCode": "RQMT_303",
      "dataType": null,
      "header": false,
      "units": null,
      "formula": null,
      "codingInstructions": null,
      "copyrightNotice": null,
      "questionCardinality": null,
      "answerCardinality": null,
      "question": "Hgb Bld-mCnc",
      "answers": null,
      "skipLogic": null,
      "restrictions": null,
      "editable": null,
      "defaultAnswer": null,
      "formatting": null,
      "calculationMethod": null,
      "parentQuestionCode": null
    },
    {
      "questionCode": "33882-2",
      "localQuestionCode": "RQMT_304",
      "dataType": null,
      "header": false,
      "units": null,
      "formula": null,
      "codingInstructions": null,
      "copyrightNotice": null,
      "questionCardinality": null,
      "answerCardinality": null,
      "question": "Collect Date XXX",
      "answers": null,
      "skipLogic": null,
      "restrictions": null,
      "editable": null,
      "defaultAnswer": null,
      "formatting": null,
      "calculationMethod": null,
      "parentQuestionCode": null
    },
    {
      "questionCode": "2276-4",
      "localQuestionCode": "RQMT_307",
      "dataType": null,
      "header": false,
      "units": null,
      "formula": null,
      "codingInstructions": null,
      "copyrightNotice": null,
      "questionCardinality": null,
      "answerCardinality": null,
      "question": "Ferritin SerPl-mCnc",
      "answers": null,
      "skipLogic": null,
      "restrictions": null,
      "editable": null,
      "defaultAnswer": null,
      "formatting": null,
      "calculationMethod": null,
      "parentQuestionCode": null
    },
    {
      "questionCode": "33882-2",
      "localQuestionCode": "RQMT_308",
      "dataType": null,
      "header": false,
      "units": null,
      "formula": null,
      "codingInstructions": null,
      "copyrightNotice": null,
      "questionCardinality": null,
      "answerCardinality": null,
      "question": "Collect Date XXX",
      "answers": null,
      "skipLogic": null,
      "restrictions": null,
      "editable": null,
      "defaultAnswer": null,
      "formatting": null,
      "calculationMethod": null,
      "parentQuestionCode": null
    },
    {
      "questionCode": "2502-3",
      "localQuestionCode": "RQMT_309",
      "dataType": null,
      "header": false,
      "units": null,
      "formula": null,
      "codingInstructions": null,
      "copyrightNotice": null,
      "questionCardinality": null,
      "answerCardinality": null,
      "question": "Iron Satn MFr SerPl",
      "answers": null,
      "skipLogic": null,
      "restrictions": null,
      "editable": null,
      "defaultAnswer": null,
      "formatting": null,
      "calculationMethod": null,
      "parentQuestionCode": null
    },
    {
      "questionCode": "33882-2",
      "localQuestionCode": "RQMT_310",
      "dataType": null,
      "header": false,
      "units": null,
      "formula": null,
      "codingInstructions": null,
      "copyrightNotice": null,
      "questionCardinality": null,
      "answerCardinality": null,
      "question": "Collect Date XXX",
      "answers": null,
      "skipLogic": null,
      "restrictions": null,
      "editable": null,
      "defaultAnswer": null,
      "formatting": null,
      "calculationMethod": null,
      "parentQuestionCode": null
    },
    {
      "questionCode": "42810-2",
      "localQuestionCode": "RQMT_312",
      "dataType": null,
      "header": false,
      "units": null,
      "formula": null,
      "codingInstructions": null,
      "copyrightNotice": null,
      "questionCardinality": null,
      "answerCardinality": null,
      "question": "Hgb Retic Qn",
      "answers": null,
      "skipLogic": null,
      "restrictions": null,
      "editable": null,
      "defaultAnswer": null,
      "formatting": null,
      "calculationMethod": null,
      "parentQuestionCode": null
    }
  ]
}