{
  "type": "LOINC",
  "code": "59453-1",
  "name": "Morse Fall Scale panel",
  "items": [
    {
      "questionCode": "59454-9",
      "question": "History of falling; immediate or within 3 months Morse Fall Scale",
      "answers": [
        {
          "text": "No",
          "code": "LA32-8"
        },
        {
          "text": "Yes",
          "code": "LA33-6"
        }
      ],
      "dataType": "CNE",
      "units": [],
      "header": false,
      "parentQuestionCode": null,
      "answerCardinality": {
        "min": "1",
        "max": "1"
      }
    },
    {
      "questionCode": "59455-6",
      "question": "Secondary diagnosis Morse Fall Scale",
      "answers": [
        {
          "text": "No",
          "code": "LA32-8"
        },
        {
          "text": "Yes",
          "code": "LA33-6"
        }
      ],
      "dataType": "CNE",
      "units": [],
      "header": false,
      "parentQuestionCode": null,
      "answerCardinality": {
        "min": "1",
        "max": "1"
      }
    },
    {
      "questionCode": "59456-4",
      "question": "Ambulatory aid Morse Fall Scale",
      "answers": [
        {
          "text": "Bed rest/nurse assist",
          "code": "LA13030-4"
        },
        {
          "text": "Crutches/cane/walker",
          "code": "LA13031-2"
        },
        {
          "text": "Furniture",
          "code": "LA13032-0"
        }
      ],
      "dataType": "CNE",
      "units": [],
      "header": false,
      "parentQuestionCode": null,
      "answerCardinality": {
        "min": "1",
        "max": "1"
      }
    },
    {
      "questionCode": "59457-2",
      "question": "Intravenous apparatus Morse Fall Scale",
      "answers": [
        {
          "text": "No",
          "code": "LA32-8"
        },
        {
          "text": "Yes",
          "code": "LA33-6"
        }
      ],
      "dataType": "CNE",
      "units": [],
      "header": false,
      "parentQuestionCode": null,
      "answerCardinality": {
        "min": "1",
        "max": "1"
      }
    },
    {
      "questionCode": "59458-0",
      "question": "Morse Fall Scale",
      "answers": [
        {
          "text": "Normal/bedrest/immobile",
          "code": "LA13033-8"
        },
        {
          "text": "Weak",
          "code": "LA13034-6"
        },
        {
          "text": "Impaired",
          "code": "LA13035-3"
        }
      ],
      "dataType": "CNE",
      "units": [],
      "header": false,
      "parentQuestionCode": null,
      "answerCardinality": {
        "min": "1",
        "max": "1"
      }
    },
    {
      "questionCode": "59459-8",
      "question": "Mental status Morse Fall Scale",
      "answers": [
        {
          "text": "Oriented to own ability",
          "code": "LA13036-1"
        },
        {
          "text": "Forgets limitations",
          "code": "LA13037-9"
        }
      ],
      "dataType": "CNE",
      "units": [],
      "header": false,
      "parentQuestionCode": null,
      "answerCardinality": {
        "min": "1",
        "max": "1"
      }
    },
    {
      "questionCode": "59460-6",
      "question": "Morse Fall risk total Morse Fall Scale",
      "dataType": null,
      "units": [],
      "header": false,
      "parentQuestionCode": null,
      "answerCardinality": {
        "min": "1",
        "max": "1"
      }
    },
    {
      "questionCode": "59461-4",
      "question": "Morse Fall risk level Morse Fall Scale",
      "answers": [
        {
          "text": "No Risk (MFS Score 0 - 24)",
          "code": "LA13038-7"
        },
        {
          "text": "Low Risk (MFS Score 25 - 45)",
          "code": "LA13039-5"
        },
        {
          "text": "High Risk (MFS Score 50+)",
          "code": "LA13040-3"
        }
      ],
      "dataType": "CNE",
      "units": [],
      "header": false,
      "parentQuestionCode": null,
      "answerCardinality": {
        "min": "1",
        "max": "1"
      }
    }
  ]
}