{
  "type": "LOINC",
  "code": "46076-6",
  "name": "MDS supplemental items section - version 2.0",
  "items": [
    {
      "questionCode": "46078-2",
      "localQuestionCode": null,
      "dataType": null,
      "header": true,
      "units": null,
      "formula": null,
      "codingInstructions": null,
      "copyrightNotice": "InterRAI holds the copyright to Version 2.0 of the RAI for long term care outside of the US. Content for MDS items in LOINC was derived from Version 2.0 of the RAI/MDS, and should not be reproduced outside of the United States without permission of InterRAI. Within the US, Version 2.0 is in the public domain.",
      "questionCardinality": null,
      "answerCardinality": null,
      "question": "Pneumococcal vaccine",
      "answers": null,
      "skipLogic": null,
      "restrictions": null,
      "editable": null,
      "defaultAnswer": null,
      "formatting": null,
      "calculationMethod": null,
      "parentQuestionCode": null
    },
    {
      "questionCode": "45956-0",
      "localQuestionCode": "W3b",
      "dataType": "CNE",
      "header": false,
      "units": null,
      "formula": null,
      "codingInstructions": null,
      "copyrightNotice": "InterRAI holds the copyright to Version 2.0 of the RAI for long term care outside of the US. Content for MDS items in LOINC was derived from Version 2.0 of the RAI/MDS, and should not be reproduced outside of the United States without permission of InterRAI. Within the US, Version 2.0 is in the public domain.",
      "questionCardinality": null,
      "answerCardinality": null,
      "question": "Reason pneumococcal vaccine not received",
      "answers": [
        {
          "label": "1",
          "code": "LA185-1",
          "text": "Not eligible",
          "score": null,
          "other": null
        },
        {
          "label": "2",
          "code": "LA186-9",
          "text": "Offered and declined",
          "score": null,
          "other": null
        },
        {
          "label": "3",
          "code": "LA187-7",
          "text": "Not offered",
          "score": null,
          "other": null
        }
      ],
      "skipLogic": null,
      "restrictions": null,
      "editable": null,
      "defaultAnswer": null,
      "formatting": null,
      "calculationMethod": null,
      "parentQuestionCode": "46078-2"
    },
    {
      "questionCode": "45955-2",
      "localQuestionCode": "W3a",
      "dataType": "CNE",
      "header": false,
      "units": null,
      "formula": null,
      "codingInstructions": null,
      "copyrightNotice": "InterRAI holds the copyright to Version 2.0 of the RAI for long term care outside of the US. Content for MDS items in LOINC was derived from Version 2.0 of the RAI/MDS, and should not be reproduced outside of the United States without permission of InterRAI. Within the US, Version 2.0 is in the public domain.",
      "questionCardinality": null,
      "answerCardinality": null,
      "question": "Pneumococcal vaccine status up to date",
      "answers": [
        {
          "label": null,
          "code": "LA1-0",
          "text": "UTD",
          "score": null,
          "other": null
        },
        {
          "label": "0",
          "code": "LA32-8",
          "text": "No",
          "score": null,
          "other": null
        },
        {
          "label": "1",
          "code": "LA33-6",
          "text": "Yes",
          "score": null,
          "other": null
        }
      ],
      "skipLogic": null,
      "restrictions": null,
      "editable": null,
      "defaultAnswer": null,
      "formatting": null,
      "calculationMethod": null,
      "parentQuestionCode": "46078-2"
    },
    {
      "questionCode": "45952-9",
      "localQuestionCode": "W1",
      "dataType": null,
      "header": false,
      "units": null,
      "formula": null,
      "codingInstructions": null,
      "copyrightNotice": "InterRAI holds the copyright to Version 2.0 of the RAI for long term care outside of the US. Content for MDS items in LOINC was derived from Version 2.0 of the RAI/MDS, and should not be reproduced outside of the United States without permission of InterRAI. Within the US, Version 2.0 is in the public domain.",
      "questionCardinality": null,
      "answerCardinality": null,
      "question": "National provider ID",
      "answers": null,
      "skipLogic": null,
      "restrictions": null,
      "editable": null,
      "defaultAnswer": null,
      "formatting": null,
      "calculationMethod": null,
      "parentQuestionCode": null
    },
    {
      "questionCode": "46077-4",
      "localQuestionCode": null,
      "dataType": null,
      "header": true,
      "units": null,
      "formula": null,
      "codingInstructions": null,
      "copyrightNotice": "InterRAI holds the copyright to Version 2.0 of the RAI for long term care outside of the US. Content for MDS items in LOINC was derived from Version 2.0 of the RAI/MDS, and should not be reproduced outside of the United States without permission of InterRAI. Within the US, Version 2.0 is in the public domain.",
      "questionCardinality": null,
      "answerCardinality": null,
      "question": "Influenza vaccine",
      "answers": null,
      "skipLogic": null,
      "restrictions": null,
      "editable": null,
      "defaultAnswer": null,
      "formatting": null,
      "calculationMethod": null,
      "parentQuestionCode": null
    },
    {
      "questionCode": "45954-5",
      "localQuestionCode": "W2b",
      "dataType": "CNE",
      "header": false,
      "units": null,
      "formula": null,
      "codingInstructions": null,
      "copyrightNotice": "InterRAI holds the copyright to Version 2.0 of the RAI for long term care outside of the US. Content for MDS items in LOINC was derived from Version 2.0 of the RAI/MDS, and should not be reproduced outside of the United States without permission of InterRAI. Within the US, Version 2.0 is in the public domain.",
      "questionCardinality": null,
      "answerCardinality": null,
      "question": "Reason influenza virus vaccine not received",
      "answers": [
        {
          "label": "1",
          "code": "LA183-6",
          "text": "Not in facility during this year's flu season",
          "score": null,
          "other": null
        },
        {
          "label": "2",
          "code": "LA184-4",
          "text": "Received outside of this facility",
          "score": null,
          "other": null
        },
        {
          "label": "3",
          "code": "LA185-1",
          "text": "Not eligible",
          "score": null,
          "other": null
        },
        {
          "label": "4",
          "code": "LA186-9",
          "text": "Offered and declined",
          "score": null,
          "other": null
        },
        {
          "label": "5",
          "code": "LA187-7",
          "text": "Not offered",
          "score": null,
          "other": null
        },
        {
          "label": "6",
          "code": "LA188-5",
          "text": "Inability to obtain vaccine",
          "score": null,
          "other": null
        }
      ],
      "skipLogic": null,
      "restrictions": null,
      "editable": null,
      "defaultAnswer": null,
      "formatting": null,
      "calculationMethod": null,
      "parentQuestionCode": "46077-4"
    },
    {
      "questionCode": "45953-7",
      "localQuestionCode": "W2a",
      "dataType": "CNE",
      "header": false,
      "units": null,
      "formula": null,
      "codingInstructions": null,
      "copyrightNotice": "InterRAI holds the copyright to Version 2.0 of the RAI for long term care outside of the US. Content for MDS items in LOINC was derived from Version 2.0 of the RAI/MDS, and should not be reproduced outside of the United States without permission of InterRAI. Within the US, Version 2.0 is in the public domain.",
      "questionCardinality": null,
      "answerCardinality": null,
      "question": "Influenza virus vaccine received in facility",
      "answers": [
        {
          "label": null,
          "code": "LA1-0",
          "text": "UTD",
          "score": null,
          "other": null
        },
        {
          "label": "0",
          "code": "LA32-8",
          "text": "No",
          "score": null,
          "other": null
        },
        {
          "label": "1",
          "code": "LA33-6",
          "text": "Yes",
          "score": null,
          "other": null
        }
      ],
      "skipLogic": null,
      "restrictions": null,
      "editable": null,
      "defaultAnswer": null,
      "formatting": null,
      "calculationMethod": null,
      "parentQuestionCode": "46077-4"
    }
  ]
}