{
  "type": "LOINC",
  "code": "44249-1",
  "name": "PHQ-9 depression survey",
  "items": [
    {
      "questionCode": "44257-4",
      "question": "PHQ-9.problem panel Reported PHQ-9",
      "dataType": null,
      "units": [],
      "header": true,
      "parentQuestionCode": null,
      "answerCardinality": {
        "min": "1",
        "max": "1"
      }
    },
    {
      "questionCode": "44250-9",
      "question": "Little interest or pleasure in doing things in last 2 weeks Reported PHQ-9",
      "answers": [
        {
          "text": "Not at all -- 0",
          "code": "LA6568-5",
          "score": 0
        },
        {
          "text": "Several days -- 1",
          "code": "LA6569-3",
          "score": 1
        },
        {
          "text": "More than half the days -- 2",
          "code": "LA6570-1",
          "score": 2
        },
        {
          "text": "Nearly every day -- 3",
          "code": "LA6571-9",
          "score": 3
        }
      ],
      "dataType": "CNE",
      "units": [],
      "header": false,
      "parentQuestionCode": null,
      "answerCardinality": {
        "min": "1",
        "max": "1"
      }
    },
    {
      "questionCode": "44255-8",
      "question": "Feeling down, depressed, or hopeless in last 2 weeks Reported PHQ-9",
      "answers": [
        {
          "text": "Not at all -- 0",
          "code": "LA6568-5",
          "score": 0
        },
        {
          "text": "Several days -- 1",
          "code": "LA6569-3",
          "score": 1
        },
        {
          "text": "More than half the days -- 2",
          "code": "LA6570-1",
          "score": 2
        },
        {
          "text": "Nearly every day -- 3",
          "code": "LA6571-9",
          "score": 3
        }
      ],
      "dataType": "CNE",
      "units": [],
      "header": false,
      "parentQuestionCode": null,
      "answerCardinality": {
        "min": "1",
        "max": "1"
      }
    },
    {
      "questionCode": "44259-0",
      "question": "Trouble falling or staying asleep, or sleeping too much in last 2 weeks Reported PHQ-9",
      "answers": [
        {
          "text": "Not at all -- 0",
          "code": "LA6568-5",
          "score": 0
        },
        {
          "text": "Several days -- 1",
          "code": "LA6569-3",
          "score": 1
        },
        {
          "text": "More than half the days -- 2",
          "code": "LA6570-1",
          "score": 2
        },
        {
          "text": "Nearly every day -- 3",
          "code": "LA6571-9",
          "score": 3
        }
      ],
      "dataType": "CNE",
      "units": [],
      "header": false,
      "parentQuestionCode": null,
      "answerCardinality": {
        "min": "1",
        "max": "1"
      }
    },
    {
      "questionCode": "44254-1",
      "question": "Feeling tired or having little energy in last 2 weeks Reported PHQ-9",
      "answers": [
        {
          "text": "Not at all -- 0",
          "code": "LA6568-5",
          "score": 0
        },
        {
          "text": "Several days -- 1",
          "code": "LA6569-3",
          "score": 1
        },
        {
          "text": "More than half the days -- 2",
          "code": "LA6570-1",
          "score": 2
        },
        {
          "text": "Nearly every day -- 3",
          "code": "LA6571-9",
          "score": 3
        }
      ],
      "dataType": "CNE",
      "units": [],
      "header": false,
      "parentQuestionCode": null,
      "answerCardinality": {
        "min": "1",
        "max": "1"
      }
    },
    {
      "questionCode": "44251-7",
      "question": "Poor appetite or overeating in last 2 weeks Reported PHQ-9",
      "answers": [
        {
          "text": "Not at all -- 0",
          "code": "LA6568-5",
          "score": 0
        },
        {
          "text": "Several days -- 1",
          "code": "LA6569-3",
          "score": 1
        },
        {
          "text": "More than half the days -- 2",
          "code": "LA6570-1",
          "score": 2
        },
        {
          "text": "Nearly every day -- 3",
          "code": "LA6571-9",
          "score": 3
        }
      ],
      "dataType": "CNE",
      "units": [],
      "header": false,
      "parentQuestionCode": null,
      "answerCardinality": {
        "min": "1",
        "max": "1"
      }
    },
    {
      "questionCode": "44258-2",
      "question": "Feeling bad about yourself - or that you are a failure or have let yourself or your family down in last 2 weeks Reported PHQ-9",
      "answers": [
        {
          "text": "Not at all -- 0",
          "code": "LA6568-5",
          "score": 0
        },
        {
          "text": "Several days -- 1",
          "code": "LA6569-3",
          "score": 1
        },
        {
          "text": "More than half the days -- 2",
          "code": "LA6570-1",
          "score": 2
        },
        {
          "text": "Nearly every day -- 3",
          "code": "LA6571-9",
          "score": 3
        }
      ],
      "dataType": "CNE",
      "units": [],
      "header": false,
      "parentQuestionCode": null,
      "answerCardinality": {
        "min": "1",
        "max": "1"
      }
    },
    {
      "questionCode": "44252-5",
      "question": "Trouble concentrating on things, such as reading the newspaper or watching television in last 2 weeks Reported PHQ-9",
      "answers": [
        {
          "text": "Not at all -- 0",
          "code": "LA6568-5",
          "score": 0
        },
        {
          "text": "Several days -- 1",
          "code": "LA6569-3",
          "score": 1
        },
        {
          "text": "More than half the days -- 2",
          "code": "LA6570-1",
          "score": 2
        },
        {
          "text": "Nearly every day -- 3",
          "code": "LA6571-9",
          "score": 3
        }
      ],
      "dataType": "CNE",
      "units": [],
      "header": false,
      "parentQuestionCode": null,
      "answerCardinality": {
        "min": "1",
        "max": "1"
      }
    },
    {
      "questionCode": "44253-3",
      "question": "Moving or speaking so slowly that other people could have noticed. Or the opposite - being so fidgety or restless that you have been moving around a lot more than usual in last 2 weeks Reported PHQ-9",
      "answers": [
        {
          "text": "Not at all -- 0",
          "code": "LA6568-5",
          "score": 0
        },
        {
          "text": "Several days -- 1",
          "code": "LA6569-3",
          "score": 1
        },
        {
          "text": "More than half the days -- 2",
          "code": "LA6570-1",
          "score": 2
        },
        {
          "text": "Nearly every day -- 3",
          "code": "LA6571-9",
          "score": 3
        }
      ],
      "dataType": "CNE",
      "units": [],
      "header": false,
      "parentQuestionCode": null,
      "answerCardinality": {
        "min": "1",
        "max": "1"
      }
    },
    {
      "questionCode": "44260-8",
      "question": "Thoughts that you would be better off dead, or of hurting yourself in some way in last 2 weeks Reported PHQ-9",
      "answers": [
        {
          "text": "Not at all -- 0",
          "code": "LA6568-5",
          "score": 0
        },
        {
          "text": "Several days -- 1",
          "code": "LA6569-3",
          "score": 1
        },
        {
          "text": "More than half the days -- 2",
          "code": "LA6570-1",
          "score": 2
        },
        {
          "text": "Nearly every day -- 3",
          "code": "LA6571-9",
          "score": 3
        }
      ],
      "dataType": "CNE",
      "units": [],
      "header": false,
      "parentQuestionCode": null,
      "answerCardinality": {
        "min": "1",
        "max": "1"
      }
    },
    {
      "formula": {
        "name": "SCORE",
        "value": []
      },
      "questionCode": "44261-6",
      "question": "PHQ-9 total score Reported PHQ-9",
      "dataType": null,
      "units": [],
      "header": false,
      "parentQuestionCode": null,
      "answerCardinality": {
        "min": "1",
        "max": "1"
      }
    },
    {
      "questionCode": "44256-6",
      "question": "Perceived difficulty in last 2 weeks Reported PHQ-9",
      "answers": [
        {
          "text": "Not difficult at all",
          "code": "LA6572-7"
        },
        {
          "text": "Somewhat difficult",
          "code": "LA6573-5"
        },
        {
          "text": "Very difficult",
          "code": "LA6575-0"
        },
        {
          "text": "Extremely difficult",
          "code": "LA6574-3"
        }
      ],
      "dataType": "CNE",
      "units": [],
      "header": false,
      "parentQuestionCode": null,
      "answerCardinality": {
        "min": "1",
        "max": "1"
      }
    }
  ]
}