{
  "type": "LOINC",
  "code": "38213-5",
  "name": "FLACC Pain Assessment Panel",
  "items": [
    {
      "questionCode": "38216-8",
      "question": "Pain severity Face FLACC",
      "answers": [
        {
          "text": "No particular expression or smile -- 0",
          "code": "LA9588-0",
          "score": 0
        },
        {
          "text": "Occasional grimace or frown, withdrawn, disinterested -- 1",
          "code": "LA9589-8",
          "score": 1
        },
        {
          "text": "Frequent to constant frown, clenched jaw, quivering chin -- 2",
          "code": "LA9590-6",
          "score": 2
        }
      ],
      "dataType": "CNE",
      "units": [],
      "header": false,
      "parentQuestionCode": null,
      "answerCardinality": {
        "min": "1",
        "max": "1"
      }
    },
    {
      "questionCode": "38217-6",
      "question": "Pain severity Legs FLACC",
      "answers": [
        {
          "text": "Normal position or relaxed -- 0",
          "code": "LA9591-4",
          "score": 0
        },
        {
          "text": "Uneasy, restless, tense -- 1",
          "code": "LA9592-2",
          "score": 1
        },
        {
          "text": "Kicking, or legs drawn up -- 2",
          "code": "LA9593-0",
          "score": 2
        }
      ],
      "dataType": "CNE",
      "units": [],
      "header": false,
      "parentQuestionCode": null,
      "answerCardinality": {
        "min": "1",
        "max": "1"
      }
    },
    {
      "questionCode": "38218-4",
      "question": "Pain severity Activity FLACC",
      "answers": [
        {
          "text": "Lying quietly, normal position, moves easily -- 0",
          "code": "LA9594-8",
          "score": 0
        },
        {
          "text": "Squirming, shifting back and forth, tense -- 1",
          "code": "LA9595-5",
          "score": 1
        },
        {
          "text": "Arched, rigid, or jerking -- 2",
          "code": "LA9596-3",
          "score": 2
        }
      ],
      "dataType": "CNE",
      "units": [],
      "header": false,
      "parentQuestionCode": null,
      "answerCardinality": {
        "min": "1",
        "max": "1"
      }
    },
    {
      "questionCode": "38219-2",
      "question": "Pain severity Cry FLACC",
      "answers": [
        {
          "text": "No cry (awake or asleep) -- 0",
          "code": "LA9597-1",
          "score": 0
        },
        {
          "text": "Moans or whimpers, occasional complaint -- 1",
          "code": "LA9598-9",
          "score": 1
        },
        {
          "text": "Crying steadily, screams or sobs, frequent complaints -- 2",
          "code": "LA9599-7",
          "score": 2
        }
      ],
      "dataType": "CNE",
      "units": [],
      "header": false,
      "parentQuestionCode": null,
      "answerCardinality": {
        "min": "1",
        "max": "1"
      }
    },
    {
      "questionCode": "38220-0",
      "question": "Pain severity Consolability FLACC",
      "answers": [
        {
          "text": "Content, relaxed -- 0",
          "code": "LA9600-3",
          "score": 0
        },
        {
          "text": "Reassured by occasional touching, hugging, or being talked to, distractable -- 1",
          "code": "LA9601-1",
          "score": 1
        },
        {
          "text": "Difficult to console or comfort -- 2",
          "code": "LA9602-9",
          "score": 2
        }
      ],
      "dataType": "CNE",
      "units": [],
      "header": false,
      "parentQuestionCode": null,
      "answerCardinality": {
        "min": "1",
        "max": "1"
      }
    },
    {
      "formula": {
        "name": "SCORE",
        "value": []
      },
      "questionCode": "38215-0",
      "question": "Pain severity total FLACC",
      "dataType": null,
      "units": [],
      "header": false,
      "parentQuestionCode": null,
      "answerCardinality": {
        "min": "1",
        "max": "1"
      }
    }
  ]
}