{
  "type": "LOINC",
  "code": "34566-0",
  "name": "Vital Signs Panel",
  "items": [
    {
      "questionCode": "8867-4",
      "question": "Heart rate",
      "dataType": null,
      "units": [
        {
          "name": "/min",
          "code": 5593
        },
        {
          "name": "bpm",
          "code": 5594
        }
      ],
      "header": false,
      "parentQuestionCode": null,
      "answerCardinality": {
        "min": "1",
        "max": "1"
      }
    },
    {
      "questionCode": "9279-1",
      "question": "Respiratory rate",
      "dataType": null,
      "units": [
        {
          "name": "/min",
          "code": 5602
        }
      ],
      "header": false,
      "parentQuestionCode": null,
      "answerCardinality": {
        "min": "1",
        "max": "1"
      }
    },
    {
      "questionCode": "35094-2",
      "question": "Blood Pressure Panel",
      "dataType": null,
      "units": [],
      "header": true,
      "parentQuestionCode": null,
      "answerCardinality": {
        "min": "1",
        "max": "1"
      }
    },
    {
      "questionCode": "8480-6",
      "question": "Systolic blood pressure",
      "dataType": null,
      "units": [
        {
          "name": "mm Hg",
          "code": 5580
        }
      ],
      "header": false,
      "parentQuestionCode": null,
      "answerCardinality": {
        "min": "1",
        "max": "1"
      }
    },
    {
      "questionCode": "8462-4",
      "question": "Diastolic blood pressure",
      "dataType": null,
      "units": [
        {
          "name": "mm Hg",
          "code": 5578
        }
      ],
      "header": false,
      "parentQuestionCode": null,
      "answerCardinality": {
        "min": "1",
        "max": "1"
      }
    },
    {
      "questionCode": "8478-0",
      "question": "Mean blood pressure",
      "dataType": null,
      "units": [
        {
          "name": "mm Hg",
          "code": 5579
        }
      ],
      "header": false,
      "parentQuestionCode": null,
      "answerCardinality": {
        "min": "1",
        "max": "1"
      }
    },
    {
      "questionCode": "8357-6",
      "question": "Blood pressure method",
      "dataType": null,
      "units": [],
      "header": false,
      "parentQuestionCode": null,
      "answerCardinality": {
        "min": "1",
        "max": "1"
      }
    },
    {
      "questionCode": "8358-4",
      "question": "Blood pressure device Cuff size",
      "answers": [
        {
          "text": "Adult standard",
          "code": "LA11162-7"
        },
        {
          "text": "Adult large",
          "code": "LA11163-5"
        },
        {
          "text": "Thigh extra large",
          "code": "LA11164-3"
        }
      ],
      "dataType": "CNE",
      "units": [
        {
          "name": "centimeters",
          "code": 5830
        }
      ],
      "header": false,
      "parentQuestionCode": null,
      "answerCardinality": {
        "min": "1",
        "max": "1"
      }
    },
    {
      "questionCode": "8359-2",
      "question": "Peripheral artery measurement site",
      "dataType": null,
      "units": [],
      "header": false,
      "parentQuestionCode": null,
      "answerCardinality": {
        "min": "1",
        "max": "1"
      }
    },
    {
      "questionCode": "9856-6",
      "question": "Blood pressure device Institution inventory number",
      "dataType": null,
      "units": [],
      "header": false,
      "parentQuestionCode": null,
      "answerCardinality": {
        "min": "1",
        "max": "1"
      }
    },
    {
      "questionCode": "9857-4",
      "question": "Blood pressure device Vendor model number",
      "dataType": null,
      "units": [],
      "header": false,
      "parentQuestionCode": null,
      "answerCardinality": {
        "min": "1",
        "max": "1"
      }
    },
    {
      "questionCode": "9858-2",
      "question": "Blood pressure device Vendor serial number",
      "dataType": null,
      "units": [],
      "header": false,
      "parentQuestionCode": null,
      "answerCardinality": {
        "min": "1",
        "max": "1"
      }
    },
    {
      "questionCode": "35095-9",
      "question": "Body temperature record (for tracking ovulation)",
      "dataType": null,
      "units": [],
      "header": true,
      "parentQuestionCode": null,
      "answerCardinality": {
        "min": "1",
        "max": "1"
      }
    },
    {
      "questionCode": "8310-5",
      "question": "Body temperature",
      "dataType": null,
      "units": [
        {
          "name": "C",
          "code": 5565
        },
        {
          "name": "DEG",
          "code": 5566
        },
        {
          "name": "Deg C",
          "code": 5567
        },
        {
          "name": "DEG F",
          "code": 5920
        }
      ],
      "header": false,
      "parentQuestionCode": null,
      "answerCardinality": {
        "min": "1",
        "max": "1"
      }
    },
    {
      "questionCode": "8326-1",
      "question": "Type of Body temperature device",
      "dataType": null,
      "units": [],
      "header": false,
      "parentQuestionCode": null,
      "answerCardinality": {
        "min": "1",
        "max": "1"
      }
    },
    {
      "questionCode": "8327-9",
      "question": "Body temperature measurement site",
      "dataType": null,
      "units": [],
      "header": false,
      "parentQuestionCode": null,
      "answerCardinality": {
        "min": "1",
        "max": "1"
      }
    },
    {
      "questionCode": "9849-1",
      "question": "Body temperature device Institution inventory number",
      "dataType": null,
      "units": [],
      "header": false,
      "parentQuestionCode": null,
      "answerCardinality": {
        "min": "1",
        "max": "1"
      }
    },
    {
      "questionCode": "9850-9",
      "question": "Body temperature device Vendor model number",
      "dataType": null,
      "units": [],
      "header": false,
      "parentQuestionCode": null,
      "answerCardinality": {
        "min": "1",
        "max": "1"
      }
    },
    {
      "questionCode": "9851-7",
      "question": "Body temperature device Vendor serial number",
      "dataType": null,
      "units": [],
      "header": false,
      "parentQuestionCode": null,
      "answerCardinality": {
        "min": "1",
        "max": "1"
      }
    }
  ]
}