{
  "type": "LOINC",
  "code": "70298-5",
  "name": "Mineral metabolism panel",
  "items": [
    {
      "questionCode": "1751-7",
      "localQuestionCode": "RQMT_296",
      "dataType": null,
      "header": false,
      "units": null,
      "formula": null,
      "codingInstructions": null,
      "copyrightNotice": null,
      "questionCardinality": null,
      "answerCardinality": null,
      "question": "Albumin SerPl-mCnc",
      "answers": null,
      "skipLogic": null,
      "restrictions": null,
      "editable": null,
      "defaultAnswer": null,
      "formatting": null,
      "calculationMethod": null,
      "parentQuestionCode": null
    },
    {
      "questionCode": "33882-2",
      "localQuestionCode": "RQMT_297",
      "dataType": null,
      "header": false,
      "units": null,
      "formula": null,
      "codingInstructions": null,
      "copyrightNotice": null,
      "questionCardinality": null,
      "answerCardinality": null,
      "question": "Collect Date XXX",
      "answers": null,
      "skipLogic": null,
      "restrictions": null,
      "editable": null,
      "defaultAnswer": null,
      "formatting": null,
      "calculationMethod": null,
      "parentQuestionCode": null
    },
    {
      "questionCode": "68900-0",
      "localQuestionCode": "RQMT_299",
      "dataType": "CNE",
      "header": false,
      "units": null,
      "formula": null,
      "codingInstructions": null,
      "copyrightNotice": null,
      "questionCardinality": null,
      "answerCardinality": null,
      "question": "Albumin Lab Method",
      "answers": [
        {
          "label": null,
          "code": "LA17963-2",
          "text": "BCG - bromocresol green",
          "score": null,
          "other": null
        },
        {
          "label": null,
          "code": "LA17964-0",
          "text": "BCP - bromocresol purple",
          "score": null,
          "other": null
        }
      ],
      "skipLogic": null,
      "restrictions": null,
      "editable": null,
      "defaultAnswer": null,
      "formatting": null,
      "calculationMethod": null,
      "parentQuestionCode": null
    },
    {
      "questionCode": "2777-1",
      "localQuestionCode": "RQMT_315",
      "dataType": null,
      "header": false,
      "units": null,
      "formula": null,
      "codingInstructions": null,
      "copyrightNotice": null,
      "questionCardinality": null,
      "answerCardinality": null,
      "question": "Phosphate SerPl-mCnc",
      "answers": null,
      "skipLogic": null,
      "restrictions": null,
      "editable": null,
      "defaultAnswer": null,
      "formatting": null,
      "calculationMethod": null,
      "parentQuestionCode": null
    },
    {
      "questionCode": "33882-2",
      "localQuestionCode": "RQMT_316",
      "dataType": null,
      "header": false,
      "units": null,
      "formula": null,
      "codingInstructions": null,
      "copyrightNotice": null,
      "questionCardinality": null,
      "answerCardinality": null,
      "question": "Collect Date XXX",
      "answers": null,
      "skipLogic": null,
      "restrictions": null,
      "editable": null,
      "defaultAnswer": null,
      "formatting": null,
      "calculationMethod": null,
      "parentQuestionCode": null
    },
    {
      "questionCode": "46099-8",
      "localQuestionCode": "RQMT_317",
      "dataType": null,
      "header": false,
      "units": null,
      "formula": null,
      "codingInstructions": null,
      "copyrightNotice": null,
      "questionCardinality": null,
      "answerCardinality": null,
      "question": "Calcium Album cor SerPl-mCnc",
      "answers": null,
      "skipLogic": null,
      "restrictions": null,
      "editable": null,
      "defaultAnswer": null,
      "formatting": null,
      "calculationMethod": null,
      "parentQuestionCode": null
    },
    {
      "questionCode": "33882-2",
      "localQuestionCode": "RQMT_318",
      "dataType": null,
      "header": false,
      "units": null,
      "formula": null,
      "codingInstructions": null,
      "copyrightNotice": null,
      "questionCardinality": null,
      "answerCardinality": null,
      "question": "Collect Date XXX",
      "answers": null,
      "skipLogic": null,
      "restrictions": null,
      "editable": null,
      "defaultAnswer": null,
      "formatting": null,
      "calculationMethod": null,
      "parentQuestionCode": null
    },
    {
      "questionCode": "17861-6",
      "localQuestionCode": "RQMT_319",
      "dataType": null,
      "header": false,
      "units": null,
      "formula": null,
      "codingInstructions": null,
      "copyrightNotice": null,
      "questionCardinality": null,
      "answerCardinality": null,
      "question": "Calcium SerPl-mCnc",
      "answers": null,
      "skipLogic": null,
      "restrictions": null,
      "editable": null,
      "defaultAnswer": null,
      "formatting": null,
      "calculationMethod": null,
      "parentQuestionCode": null
    },
    {
      "questionCode": "33882-2",
      "localQuestionCode": "RQMT_320",
      "dataType": null,
      "header": false,
      "units": null,
      "formula": null,
      "codingInstructions": null,
      "copyrightNotice": null,
      "questionCardinality": null,
      "answerCardinality": null,
      "question": "Collect Date XXX",
      "answers": null,
      "skipLogic": null,
      "restrictions": null,
      "editable": null,
      "defaultAnswer": null,
      "formatting": null,
      "calculationMethod": null,
      "parentQuestionCode": null
    }
  ]
}