{
  "type": "LOINC",
  "code": "48543-3",
  "name": "GDS.short Panel",
  "items": [
    {
      "questionCode": "48512-8",
      "question": "Are you basically satisfied with your life GDS",
      "answers": [
        {
          "text": "Yes -- 0",
          "code": "LA33-6",
          "score": 0
        },
        {
          "text": "No -- 1",
          "code": "LA32-8",
          "score": 1
        }
      ],
      "dataType": "CNE",
      "units": [],
      "header": false,
      "parentQuestionCode": null,
      "answerCardinality": {
        "min": "1",
        "max": "1"
      }
    },
    {
      "questionCode": "48513-6",
      "question": "Have you dropped many of your activities and interests GDS",
      "answers": [
        {
          "text": "Yes -- 1",
          "code": "LA33-6",
          "score": 1
        },
        {
          "text": "No -- 0",
          "code": "LA32-8",
          "score": 0
        }
      ],
      "dataType": "CNE",
      "units": [],
      "header": false,
      "parentQuestionCode": null,
      "answerCardinality": {
        "min": "1",
        "max": "1"
      }
    },
    {
      "questionCode": "48514-4",
      "question": "Do you feel that your life is empty GDS",
      "answers": [
        {
          "text": "Yes -- 1",
          "code": "LA33-6",
          "score": 1
        },
        {
          "text": "No -- 0",
          "code": "LA32-8",
          "score": 0
        }
      ],
      "dataType": "CNE",
      "units": [],
      "header": false,
      "parentQuestionCode": null,
      "answerCardinality": {
        "min": "1",
        "max": "1"
      }
    },
    {
      "questionCode": "48515-1",
      "question": "Do you often get bored GDS",
      "answers": [
        {
          "text": "Yes -- 1",
          "code": "LA33-6",
          "score": 1
        },
        {
          "text": "No -- 0",
          "code": "LA32-8",
          "score": 0
        }
      ],
      "dataType": "CNE",
      "units": [],
      "header": false,
      "parentQuestionCode": null,
      "answerCardinality": {
        "min": "1",
        "max": "1"
      }
    },
    {
      "questionCode": "48518-5",
      "question": "Are you in good spirits most of the time GDS",
      "answers": [
        {
          "text": "Yes -- 0",
          "code": "LA33-6",
          "score": 0
        },
        {
          "text": "No -- 1",
          "code": "LA32-8",
          "score": 1
        }
      ],
      "dataType": "CNE",
      "units": [],
      "header": false,
      "parentQuestionCode": null,
      "answerCardinality": {
        "min": "1",
        "max": "1"
      }
    },
    {
      "questionCode": "48519-3",
      "question": "Are you afraid that something bad is going to happen to you GDS",
      "answers": [
        {
          "text": "Yes -- 1",
          "code": "LA33-6",
          "score": 1
        },
        {
          "text": "No -- 0",
          "code": "LA32-8",
          "score": 0
        }
      ],
      "dataType": "CNE",
      "units": [],
      "header": false,
      "parentQuestionCode": null,
      "answerCardinality": {
        "min": "1",
        "max": "1"
      }
    },
    {
      "questionCode": "48520-1",
      "question": "Do you feel happy most of the time GDS",
      "answers": [
        {
          "text": "Yes -- 0",
          "code": "LA33-6",
          "score": 0
        },
        {
          "text": "No -- 1",
          "code": "LA32-8",
          "score": 1
        }
      ],
      "dataType": "CNE",
      "units": [],
      "header": false,
      "parentQuestionCode": null,
      "answerCardinality": {
        "min": "1",
        "max": "1"
      }
    },
    {
      "questionCode": "48521-9",
      "question": "Do you often feel helpless GDS",
      "answers": [
        {
          "text": "Yes -- 1",
          "code": "LA33-6",
          "score": 1
        },
        {
          "text": "No -- 0",
          "code": "LA32-8",
          "score": 0
        }
      ],
      "dataType": "CNE",
      "units": [],
      "header": false,
      "parentQuestionCode": null,
      "answerCardinality": {
        "min": "1",
        "max": "1"
      }
    },
    {
      "questionCode": "48523-5",
      "question": "Do you prefer to stay at home, rather than going out and doing new things GDS",
      "answers": [
        {
          "text": "Yes -- 1",
          "code": "LA33-6",
          "score": 1
        },
        {
          "text": "No -- 0",
          "code": "LA32-8",
          "score": 0
        }
      ],
      "dataType": "CNE",
      "units": [],
      "header": false,
      "parentQuestionCode": null,
      "answerCardinality": {
        "min": "1",
        "max": "1"
      }
    },
    {
      "questionCode": "48525-0",
      "question": "Do you feel you have more problems with memory than most GDS",
      "answers": [
        {
          "text": "Yes -- 1",
          "code": "LA33-6",
          "score": 1
        },
        {
          "text": "No -- 0",
          "code": "LA32-8",
          "score": 0
        }
      ],
      "dataType": "CNE",
      "units": [],
      "header": false,
      "parentQuestionCode": null,
      "answerCardinality": {
        "min": "1",
        "max": "1"
      }
    },
    {
      "questionCode": "48526-8",
      "question": "Do you think it is wonderful to be alive now GDS",
      "answers": [
        {
          "text": "Yes -- 0",
          "code": "LA33-6",
          "score": 0
        },
        {
          "text": "No -- 1",
          "code": "LA32-8",
          "score": 1
        }
      ],
      "dataType": "CNE",
      "units": [],
      "header": false,
      "parentQuestionCode": null,
      "answerCardinality": {
        "min": "1",
        "max": "1"
      }
    },
    {
      "questionCode": "48528-4",
      "question": "Do you feel pretty worthless the way you are now GDS",
      "answers": [
        {
          "text": "Yes -- 1",
          "code": "LA33-6",
          "score": 1
        },
        {
          "text": "No -- 0",
          "code": "LA32-8",
          "score": 0
        }
      ],
      "dataType": "CNE",
      "units": [],
      "header": false,
      "parentQuestionCode": null,
      "answerCardinality": {
        "min": "1",
        "max": "1"
      }
    },
    {
      "questionCode": "48532-6",
      "question": "Do you feel full of energy GDS",
      "answers": [
        {
          "text": "Yes -- 0",
          "code": "LA33-6",
          "score": 0
        },
        {
          "text": "No -- 1",
          "code": "LA32-8",
          "score": 1
        }
      ],
      "dataType": "CNE",
      "units": [],
      "header": false,
      "parentQuestionCode": null,
      "answerCardinality": {
        "min": "1",
        "max": "1"
      }
    },
    {
      "questionCode": "48533-4",
      "question": "Do you feel that your situation is hopeless GDS",
      "answers": [
        {
          "text": "Yes -- 1",
          "code": "LA33-6",
          "score": 1
        },
        {
          "text": "No -- 0",
          "code": "LA32-8",
          "score": 0
        }
      ],
      "dataType": "CNE",
      "units": [],
      "header": false,
      "parentQuestionCode": null,
      "answerCardinality": {
        "min": "1",
        "max": "1"
      }
    },
    {
      "questionCode": "48534-2",
      "question": "Do you think that most people are better off than you are GDS",
      "answers": [
        {
          "text": "Yes -- 1",
          "code": "LA33-6",
          "score": 1
        },
        {
          "text": "No -- 0",
          "code": "LA32-8",
          "score": 0
        }
      ],
      "dataType": "CNE",
      "units": [],
      "header": false,
      "parentQuestionCode": null,
      "answerCardinality": {
        "min": "1",
        "max": "1"
      }
    },
    {
      "formula": {
        "name": "SCORE",
        "value": []
      },
      "questionCode": "48545-8",
      "question": "Geriatric depression scale (GDS) short version total",
      "dataType": null,
      "units": [],
      "header": false,
      "parentQuestionCode": null,
      "answerCardinality": {
        "min": "1",
        "max": "1"
      }
    }
  ]
}