{
  "type": "LOINC",
  "code": "38228-3",
  "name": "Braden scale skin assessment panel",
  "items": [
    {
      "questionCode": "38222-6",
      "question": "Sensory perception Braden scale",
      "answers": [
        {
          "text": "Completely limited -- 1",
          "code": "LA9603-7",
          "score": 1
        },
        {
          "text": "Very limited -- 2",
          "code": "LA9604-5",
          "score": 2
        },
        {
          "text": "Slightly limited -- 3",
          "code": "LA9605-2",
          "score": 3
        },
        {
          "text": "No impairment -- 4",
          "code": "LA9606-0",
          "score": 4
        }
      ],
      "dataType": "CNE",
      "units": [],
      "header": false,
      "parentQuestionCode": null,
      "answerCardinality": {
        "min": "1",
        "max": "1"
      }
    },
    {
      "questionCode": "38229-1",
      "question": "Moisture exposure Braden scale",
      "answers": [
        {
          "text": "Constantly moist -- 1",
          "code": "LA9607-8",
          "score": 1
        },
        {
          "text": "Very moist -- 2",
          "code": "LA9608-6",
          "score": 2
        },
        {
          "text": "Occasionally moist -- 3",
          "code": "LA9609-4",
          "score": 3
        },
        {
          "text": "Rarely moist -- 4",
          "code": "LA9610-2",
          "score": 4
        }
      ],
      "dataType": "CNE",
      "units": [],
      "header": false,
      "parentQuestionCode": null,
      "answerCardinality": {
        "min": "1",
        "max": "1"
      }
    },
    {
      "questionCode": "38223-4",
      "question": "Physical activity Braden scale",
      "answers": [
        {
          "text": "Bedfast -- 1",
          "code": "LA6742-6",
          "score": 1
        },
        {
          "text": "Chairfast -- 2",
          "code": "LA9611-0",
          "score": 2
        },
        {
          "text": "Walks occasionally -- 3",
          "code": "LA9612-8",
          "score": 3
        },
        {
          "text": "Walks frequently -- 4",
          "code": "LA9613-6",
          "score": 4
        }
      ],
      "dataType": "CNE",
      "units": [],
      "header": false,
      "parentQuestionCode": null,
      "answerCardinality": {
        "min": "1",
        "max": "1"
      }
    },
    {
      "questionCode": "38224-2",
      "question": "Physical mobility Braden scale",
      "answers": [
        {
          "text": "Completely immobile -- 1",
          "code": "LA9614-4",
          "score": 1
        },
        {
          "text": "Very limited -- 2",
          "code": "LA9604-5",
          "score": 2
        },
        {
          "text": "Slightly limited -- 3",
          "code": "LA9605-2",
          "score": 3
        },
        {
          "text": "No limitation -- 4",
          "code": "LA120-8",
          "score": 4
        }
      ],
      "dataType": "CNE",
      "units": [],
      "header": false,
      "parentQuestionCode": null,
      "answerCardinality": {
        "min": "1",
        "max": "1"
      }
    },
    {
      "questionCode": "38225-9",
      "question": "Nutrition intake pattern Braden scale",
      "answers": [
        {
          "text": "Very poor -- 1",
          "code": "LA9615-1",
          "score": 1
        },
        {
          "text": "Probably inadequate -- 2",
          "code": "LA9616-9",
          "score": 2
        },
        {
          "text": "Adequate -- 3",
          "code": "LA8913-1",
          "score": 3
        },
        {
          "text": "Excellent -- 4",
          "code": "LA9206-9",
          "score": 4
        }
      ],
      "dataType": "CNE",
      "units": [],
      "header": false,
      "parentQuestionCode": null,
      "answerCardinality": {
        "min": "1",
        "max": "1"
      }
    },
    {
      "questionCode": "38226-7",
      "question": "Friction & sheer Braden scale",
      "answers": [
        {
          "text": "Problem -- 1",
          "code": "LA9617-7",
          "score": 1
        },
        {
          "text": "Potential problem -- 2",
          "code": "LA9618-5",
          "score": 2
        },
        {
          "text": "No apparent problem -- 3",
          "code": "LA9619-3",
          "score": 3
        }
      ],
      "dataType": "CNE",
      "units": [],
      "header": false,
      "parentQuestionCode": null,
      "answerCardinality": {
        "min": "1",
        "max": "1"
      }
    },
    {
      "formula": {
        "name": "SCORE",
        "value": []
      },
      "questionCode": "38227-5",
      "question": "Braden scale total score",
      "dataType": null,
      "units": [],
      "header": false,
      "parentQuestionCode": null,
      "answerCardinality": {
        "min": "1",
        "max": "1"
      }
    }
  ]
}